{
  "$schema": "../schema/level.schema.json",
  "name": "Stage 1 - First Contact",
  "background": "space_blue",
  "music": "stage1",
  "seed": 1,
  "waves": [
    { "formation": "line",    "roster": { "bydo_basic": 1.0 }, "y": 300, "delay": 2.0 },
    { "formation": "line",    "roster": { "bydo_basic": 1.0 }, "y": 780, "delay": 4.0 },
    { "formation": "v",       "roster": { "bydo_basic": 0.7, "bydo_wave": 0.3 }, "y": "random", "delay": 3.0, "waitForClear": true },
    { "formation": "pyramid", "roster": { "bydo_basic": 0.5, "bydo_wave": 0.3, "bydo_tank": 0.2 }, "y": "center", "delay": 2.0, "waitForClear": true }
  ],
  "terrain": null,
  "boss": null
}
