{
  "$schema": "../schema/level.schema.json",
  "name": "Stage 2 - The Narrows",
  "background": "space_red",
  "music": "stage2",
  "seed": 2,
  "waves": [
    { "formation": "column", "roster": { "bydo_basic": 1.0 }, "y": "center", "delay": 2.0 },
    { "formation": "snake", "roster": { "bydo_wave": 1.0 }, "y": "random", "delay": 5.0, "repeat": 2, "repeatDelay": 3.0 },
    { "formation": "pincer", "roster": { "bydo_basic": 0.6, "bydo_tank": 0.4 }, "y": "center", "delay": 4.0, "waitForClear": true },
    { "formation": "pyramid", "roster": { "bydo_basic": 0.4, "bydo_wave": 0.4, "bydo_tank": 0.2 }, "y": "random", "delay": 3.0, "waitForClear": true }
  ],
  "terrain": {
    "startAt": 4.0,
    "scrollSpeed": 120,
    "tileSize": 60,
    "tiles": {
      "#": { "sprite": "rock", "contactDamage": 1, "solid": true },
      "x": { "sprite": "crate", "contactDamage": 1, "solid": true, "health": 3 },
      "^": { "sprite": "spikes", "contactDamage": 2, "solid": false }
    },
    "map": [
      "################################################################",
      "          ####                ####                              ",
      "          ####                ####                              ",
      "          ####                ####                              ",
      "          ####                ####                              ",
      "          ####                ####                              ",
      "                              ####                              ",
      "                                 x                              ",
      "                                 x                              ",
      "                                 x                              ",
      "                                 x                              ",
      "                              ####                              ",
      "                    ####      ####                              ",
      "                    ####      ####                              ",
      "                    ####      ####                              ",
      "                    ####      ####                              ",
      "                    ####      ####      ^^^^^^^^^^              ",
      "################################################################"
    ]
  },
  "boss": { "id": "dobkeratops", "delay": 3.0 }
}
